{
  "bug_id": "306056",
  "summary": "window.stop() crashes Firefox [@ nsGlobalWindow::ScrollByLines]",
  "status": "VERIFIED",
  "resolution": "FIXED",
  "product": "Firefox",
  "component": "General",
  "version": "1.5.0.x Branch",
  "severity": "critical",
  "priority": "--",
  "creation_time": "2005-08-26T15:26:24Z",
  "last_change_time": "2011-06-09T21:58:42Z",
  "is_recent": false,
  "crash_signature_raw": "[@ nsGlobalWindow::ScrollByLines]",
  "crash_signatures": [
    "nsGlobalWindow::ScrollByLines"
  ],
  "keywords": [
    "crash",
    "crashreportid",
    "testcase",
    "verified1.8"
  ],
  "regressed_by": [],
  "regressions": [],
  "bugzilla_url": "https://bugzilla.mozilla.org/show_bug.cgi?id=306056",
  "socorro_links": [],
  "socorro_crash_ids": [],
  "has_socorro_link": false,
  "has_direct_crash_id": false,
  "stack_traces": [
    {
      "comment_id": 2593661,
      "comment_count": 10,
      "creator": "mozilla2005@julien.plissonneau.duquene.net",
      "creation_time": "2005-08-28T10:04:08Z",
      "raw_text": "Below is an Apple Crash Report for Firefox 1.0.6. I also tested Camino, it did\nnot crash. Apparently the crash occurs in GlobalWindowImpl::Stop().\n\nDate/Time:      2005-08-28 11:31:53.171 +0200\nOS Version:     10.4.2 (Build 8C46)\nReport Version: 3\n\nCommand: firefox-bin\nPath:    /Applications/Firefox.app/Contents/MacOS/firefox-bin\nParent:  WindowServer [67]\n\nVersion: 1.0.6 (1.0.6)\n\nPID:    206\nThread: 0\n\nException:  EXC_BAD_ACCESS (0x0001)\nCodes:      KERN_PROTECTION_FAILURE (0x0002) at 0x00000000\n\nThread 0 Crashed:\n0   org.mozilla.firefox \t0x002f5d64 GlobalWindowImpl::Stop() + 56\n1   libxpcom.dylib      \t0x0705997c _XPTC_InvokeByIndex + 216\n2   org.mozilla.firefox \t0x000330a0\nXPCWrappedNative::CallMethod(XPCCallContext&, XPCWrappedNative::CallMode) + 2508\n3   org.mozilla.firefox \t0x00028f34 XPC_WN_CallMethod(JSContext*, JSObject*,\nunsigned, long*, long*) + 220\n4   libmozjs.dylib      \t0x060291a8 js_Invoke + 1716\n5   libmozjs.dylib      \t0x060305c4 js_Interpret + 26324\n6   libmozjs.dylib      \t0x06029784 js_Execute + 496\n7   libmozjs.dylib      \t0x06007228 JS_EvaluateUCScriptForPrincipals + 88\n8   org.mozilla.firefox \t0x00416414 nsJSContext::EvaluateString(nsAString\nconst&, void*, nsIPrincipal*, char const*, unsigned, char const*, nsAString&,\nint*) + 860\n9   org.mozilla.firefox \t0x003d32f0\nnsScriptLoader::EvaluateScript(nsScriptLoadRequest*, nsString const&) + 420\n10  org.mozilla.firefox \t0x003d2f24\nnsScriptLoader::ProcessRequest(nsScriptLoadRequest*) + 180\n11  org.mozilla.firefox \t0x003d2cd0\nnsScriptLoader::ProcessScriptElement(nsIDOMHTMLScriptElement*,\nnsIScriptLoaderObserver*) + 2948\n12  org.mozilla.firefox \t0x003fc4b0 nsHTMLScriptElement::MaybeProcessScript() + 152\n13  org.mozilla.firefox \t0x0030556c nsGenericElement::AppendChildTo(nsIContent*,\nint, int) + 284\n14  org.mozilla.firefox \t0x00293670\nHTMLContentSink::ProcessSCRIPTTag(nsIParserNode const&) + 1068\n15  org.mozilla.firefox \t0x002911e4 HTMLContentSink::AddLeaf(nsIParserNode\nconst&) + 284\n16  org.mozilla.firefox \t0x0029109c\nHTMLContentSink::AddHeadContent(nsIParserNode const&) + 276\n17  org.mozilla.firefox \t0x0014e594 CNavDTD::AddHeadLeaf(nsIParserNode*) + 300\n18  org.mozilla.firefox \t0x0014b25c CNavDTD::HandleStartToken(CToken*) + 592\n19  org.mozilla.firefox \t0x00149c38 CNavDTD::HandleToken(CToken*, nsIParser*) + 1724\n20  org.mozilla.firefox \t0x00148db8 CNavDTD::BuildModel(nsIParser*,\nnsITokenizer*, nsITokenObserver*, nsIContentSink*) + 648\n21  org.mozilla.firefox \t0x00151314 nsParser::BuildModel() + 180\n22  org.mozilla.firefox \t0x0015101c nsParser::ResumeParse(int, int, int) + 292\n23  org.mozilla.firefox \t0x001523e0 nsParser::OnDataAvailable(nsIRequest*,\nnsISupports*, nsIInputStream*, unsigned, unsigned) + 316\n24  org.mozilla.firefox \t0x0053d384\nnsDocumentOpenInfo::OnDataAvailable(nsIRequest*, nsISupports*, nsIInputStream*,\nunsigned, unsigned) + 44\n25  org.mozilla.firefox \t0x000bdfd8\nnsStreamListenerTee::OnDataAvailable(nsIRequest*, nsISupports*, nsIInputStream*,\nunsigned, unsigned) + 304\n26  org.mozilla.firefox \t0x000d0a78 nsHttpChannel::OnDataAvailable(nsIRequest*,\nnsISupports*, nsIInputStream*, unsigned, unsigned) + 308\n27  org.mozilla.firefox \t0x000ad1b4 nsInputStreamPump::OnStateTransfer() + 248\n28  org.mozilla.firefox \t0x000acf9c\nnsInputStreamPump::OnInputStreamReady(nsIAsyncInputStream*) + 116\n29  libxpcom.dylib      \t0x0708010c\nnsAStreamCopier::PostContinuationEvent_Locked() + 1240\n30  libxpcom.dylib      \t0x07041cf8 PL_HandleEvent + 36\n31  libxpcom.dylib      \t0x07041c1c PL_ProcessPendingEvents + 128\n32  libxpcom.dylib      \t0x07042100 PL_IsQueueNative + 136\n33  com.apple.HIToolbox \t0x931288d4 DispatchEventToHandlers(EventTargetRec*,\nOpaqueEventRef*, HandlerCallRec*) + 692\n34  com.apple.HIToolbox \t0x9312802c\nSendEventToEventTargetInternal(OpaqueEventRef*, OpaqueEventTargetRef*,\nHandlerCallRec*) + 372\n35  com.apple.HIToolbox \t0x93127ea8 SendEventToEventTargetWithOptions + 40\n36  com.apple.HIToolbox \t0x9312f1ec\nToolboxEventDispatcherHandler(OpaqueEventHandlerCallRef*, OpaqueEventRef*,\nvoid*) + 704\n37  com.apple.HIToolbox \t0x93128b24 DispatchEventToHandlers(EventTargetRec*,\nOpaqueEventRef*, HandlerCallRec*) + 1284\n38  com.apple.HIToolbox \t0x9312802c\nSendEventToEventTargetInternal(OpaqueEventRef*, OpaqueEventTargetRef*,\nHandlerCallRec*) + 372\n39  com.apple.HIToolbox \t0x9312edb0 SendEventToEventTarget + 40\n40  com.apple.HIToolbox \t0x9316fce0 ToolboxEventDispatcher + 92\n41  com.apple.HIToolbox \t0x9320ece4 TryEventDispatcher + 112\n42  com.apple.HIToolbox \t0x9320e938 GetOrPeekEvent + 304\n43  com.apple.HIToolbox \t0x9320e674 GetNextEventMatchingMask + 156\n44  com.apple.HIToolbox \t0x9320e51c WNEInternal + 140\n45  com.apple.HIToolbox \t0x9320e47c WaitNextEvent + 76\n46  org.mozilla.firefox \t0x001d5934 nsMacMessagePump::GetEvent(EventRecord&) + 116\n47  org.mozilla.firefox \t0x001d5818 nsMacMessagePump::DoMessagePump() + 48\n48  org.mozilla.firefox \t0x001bcd0c nsAppShell::Run() + 56\n49  org.mozilla.firefox \t0x007f1904 xre_main(int, char**, nsXREAppData const*) +\n2752\n50  org.mozilla.firefox \t0x0000f54c start + 432\n51  org.mozilla.firefox \t0x0000f3cc start + 48\n\nThread 1:\n0   libSystem.B.dylib   \t0x9001efec select + 12\n1   libnspr4.dylib      \t0x0301f7dc poll + 392\n2   libnspr4.dylib      \t0x0301c028 PR_OpenDir + 944\n3   org.mozilla.firefox \t0x000b98b0 nsSocketTransportService::Run() + 408\n4   libxpcom.dylib      \t0x070449c4 nsThread::Main(void*) + 56\n5   libnspr4.dylib      \t0x0301d470 PR_Select + 828\n6   libSystem.B.dylib   \t0x9002c3d4 _pthread_body + 96\n\nThread 2:\n0   libSystem.B.dylib   \t0x9000a778 mach_msg_trap + 8\n1   libSystem.B.dylib   \t0x9000a6bc mach_msg + 60\n2   libjvm.dylib        \t0x94deae48 JNI_CreateJavaVM_Impl + 5936\n3   libjvm.dylib        \t0x94deaddc JNI_CreateJavaVM_Impl + 5828\n4   libjvm.dylib        \t0x94dabfe0 JVM_GetClassMethodsCount + 520\n5   libSystem.B.dylib   \t0x9002c3d4 _pthread_body + 96\n\nThread 3:\n0   libSystem.B.dylib   \t0x9000a778 mach_msg_trap + 8\n1   libSystem.B.dylib   \t0x9000a6bc mach_msg + 60\n2   libjvm.dylib        \t0x94d48cb4 JVM_NewInstance + 8136\n3   libjvm.dylib        \t0x94d68304 JVM_FillInStackTrace + 692\n4   libjvm.dylib        \t0x94d6dd10 JVM_Send + 17088\n5   libjvm.dylib        \t0x94dffd38 JNI_CreateJavaVM_Impl + 91680\n6   libjvm.dylib        \t0x94dabfe0 JVM_GetClassMethodsCount + 520\n7   libSystem.B.dylib   \t0x9002c3d4 _pthread_body + 96\n\nThread 4:\n0   libSystem.B.dylib   \t0x9000a778 mach_msg_trap + 8\n1   libSystem.B.dylib   \t0x9000a6bc mach_msg + 60\n2   libjvm.dylib        \t0x94d48c20 JVM_NewInstance + 7988\n3   libjvm.dylib        \t0x94d50df0 JVM_ArrayCopy + 1240\n4   libjvm.dylib        \t0x94d66f28 JVM_MonitorNotify + 1908\n5   libjvm.dylib        \t0x94d67b9c JVM_MonitorWait + 216\n6   <<00000000>> \t0x0e10a668 0 + 235972200\n7   <<00000000>> \t0x0e10868c 0 + 235964044\n8   <<00000000>> \t0x0e10868c 0 + 235964044\n9   <<00000000>> \t0xa4d51f30 typeinfo name for std::bad_exception + 28296\n10  libjvm.dylib        \t0x94d464ac JVM_CurrentTimeMillis + 4968\n11  libjvm.dylib        \t0x94d7b970 JVM_GetCPClassNameUTF + 6044\n12  libjvm.dylib        \t0x94d811e4 JVM_FindClassFromClass + 2668\n13  libjvm.dylib        \t0x94d9a508 JVM_IsSameClassPackage + 4016\n14  libjvm.dylib        \t0x94d94adc JVM_GetMethodIxExceptionTableEntry + 8240\n15  libjvm.dylib        \t0x94e82f08 JVM_FindSignal + 208316\n16  libjvm.dylib        \t0x94dabfe0 JVM_GetClassMethodsCount + 520\n17  libSystem.B.dylib   \t0x9002c3d4 _pthread_body + 96\n\nThread 5:\n0   libSystem.B.dylib   \t0x9000a778 mach_msg_trap + 8\n1   libSystem.B.dylib   \t0x9000a6bc mach_msg + 60\n2   libjvm.dylib        \t0x94d48c20 JVM_NewInstance + 7988\n3   libjvm.dylib        \t0x94d50df0 JVM_ArrayCopy + 1240\n4   libjvm.dylib        \t0x94d66f28 JVM_MonitorNotify + 1908\n5   libjvm.dylib        \t0x94d67b9c JVM_MonitorWait + 216\n6   <<00000000>> \t0x0e10a668 0 + 235972200\n7   <<00000000>> \t0x0e10868c 0 + 235964044\n8   <<00000000>> \t0x0e1085cc 0 + 235963852\n9   <<00000000>> \t0x0e1085cc 0 + 235963852\n10  <<00000000>> \t0xa4d51f30 typeinfo name for std::bad_exception + 28296\n11  libjvm.dylib        \t0x94d464ac JVM_CurrentTimeMillis + 4968\n12  libjvm.dylib        \t0x94d7b970 JVM_GetCPClassNameUTF + 6044\n13  libjvm.dylib        \t0x94d811e4 JVM_FindClassFromClass + 2668\n14  libjvm.dylib        \t0x94d9a508 JVM_IsSameClassPackage + 4016\n15  libjvm.dylib        \t0x94d94adc JVM_GetMethodIxExceptionTableEntry + 8240\n16  libjvm.dylib        \t0x94e82f08 JVM_FindSignal + 208316\n17  libjvm.dylib        \t0x94dabfe0 JVM_GetClassMethodsCount + 520\n18  libSystem.B.dylib   \t0x9002c3d4 _pthread_body + 96\n\nThread 6:\n0   libSystem.B.dylib   \t0x9000a778 mach_msg_trap + 8\n1   libSystem.B.dylib   \t0x9000a6bc mach_msg + 60\n2   libjvm.dylib        \t0x94d48cb4 JVM_NewInstance + 8136\n3   libjvm.dylib        \t0x94d4fdcc JVM_GetClassLoader + 6148\n4   libjvm.dylib        \t0x94d4fb74 JVM_GetClassLoader + 5548\n5   libjvm.dylib        \t0x94dabfe0 JVM_GetClassMethodsCount + 520\n6   libSystem.B.dylib   \t0x9002c3d4 _pthread_body + 96\n\nThread 7:\n0   libSystem.B.dylib   \t0x9000a778 mach_msg_trap + 8\n1   libSystem.B.dylib   \t0x9000a6bc mach_msg + 60\n2   libjvm.dylib        \t0x94d48c20 JVM_NewInstance + 7988\n3   libjvm.dylib        \t0x94d6835c JVM_FillInStackTrace + 780\n4   libjvm.dylib        \t0x94e020a4 JVM_InitProperties + 6836\n5   libjvm.dylib        \t0x94e01ea0 JVM_InitProperties + 6320\n6   libjvm.dylib        \t0x94e82f08 JVM_FindSignal + 208316\n7   libjvm.dylib        \t0x94dabfe0 JVM_GetClassMethodsCount + 520\n8   libSystem.B.dylib   \t0x9002c3d4 _pthread_body + 96\n\nThread 8:\n0   libSystem.B.dylib   \t0x9000a778 mach_msg_trap + 8\n1   libSystem.B.dylib   \t0x9000a6bc mach_msg + 60\n2   libjvm.dylib        \t0x94d48c20 JVM_NewInstance + 7988\n3   libjvm.dylib        \t0x94d6835c JVM_FillInStackTrace + 780\n4   libjvm.dylib        \t0x94d90710 JVM_StartThread + 1388\n5   libjvm.dylib        \t0x94d7f280 JVM_FindLoadedClass + 2632\n6   libjvm.dylib        \t0x94e82f08 JVM_FindSignal + 208316\n7   libjvm.dylib        \t0x94dabfe0 JVM_GetClassMethodsCount + 520\n8   libSystem.B.dylib   \t0x9002c3d4 _pthread_body + 96\n\nThread 9:\n0   libSystem.B.dylib   \t0x90056418 semaphore_timedwait_signal_trap + 8\n1   libSystem.B.dylib   \t0x90056284 pthread_cond_timedwait + 704\n2   libnspr4.dylib      \t0x03018390 PR_Unlock + 300\n3   libnspr4.dylib      \t0x030185f4 PR_WaitCondVar + 136\n4   libxpcom.dylib      \t0x070474d8 TimerThread::Run() + 428\n5   libxpcom.dylib      \t0x070449c4 nsThread::Main(void*) + 56\n6   libnspr4.dylib      \t0x0301d470 PR_Select + 828\n7   libSystem.B.dylib   \t0x9002c3d4 _pthread_body + 96\n\nThread 10:\n0   libSystem.B.dylib   \t0x90056418 semaphore_timedwait_signal_trap + 8\n1   libSystem.B.dylib   \t0x90056284 pthread_cond_timedwait + 704\n2   libnspr4.dylib      \t0x03018390 PR_Unlock + 300\n3   libnspr4.dylib      \t0x030185f4 PR_WaitCondVar + 136\n4   org.mozilla.firefox \t0x00078088 nsIOThreadPool::ThreadFunc(void*) + 116\n5   libnspr4.dylib      \t0x0301d470 PR_Select + 828\n6   libSystem.B.dylib   \t0x9002c3d4 _pthread_body + 96\n\nThread 11:\n0   libSystem.B.dylib   \t0x90056418 semaphore_timedwait_signal_trap + 8\n1   libSystem.B.dylib   \t0x90056284 pthread_cond_timedwait + 704\n2   libnspr4.dylib      \t0x03018390 PR_Unlock + 300\n3   libnspr4.dylib      \t0x030185f4 PR_WaitCondVar + 136\n4   org.mozilla.firefox \t0x000c5c58\nnsHostResolver::GetHostToLookup(nsHostRecord**) + 132\n5   org.mozilla.firefox \t0x000c5f68 nsHostResolver::ThreadFunc(void*) + 116\n6   libnspr4.dylib      \t0x0301d470 PR_Select + 828\n7   libSystem.B.dylib   \t0x9002c3d4 _pthread_body + 96\n\nThread 12:\n0   libSystem.B.dylib   \t0x90056418 semaphore_timedwait_signal_trap + 8\n1   libSystem.B.dylib   \t0x90056284 pthread_cond_timedwait + 704\n2   libnspr4.dylib      \t0x03018390 PR_Unlock + 300\n3   libnspr4.dylib      \t0x030185f4 PR_WaitCondVar + 136\n4   org.mozilla.firefox \t0x00078088 nsIOThreadPool::ThreadFunc(void*) + 116\n5   libnspr4.dylib      \t0x0301d470 PR_Select + 828\n6   libSystem.B.dylib   \t0x9002c3d4 _pthread_body + 96\n\nThread 0 crashed with PPC Thread State 64:\n  srr0: 0x00000000002f5d64 srr1: 0x000000000200f930                       \nvrsave: 0x0000000000000000\n    cr: 0x48044222          xer: 0x0000000020000007   lr: 0x00000000002f5d5c \nctr: 0x00000000070655c0\n    r0: 0x00000000002f5d5c   r1: 0x00000000bfffd3c0   r2: 0x000000000208ab38  \nr3: 0x0000000000000000\n    r4: 0x0000000000000003   r5: 0x00000000bfffd3a0   r6: 0x0000000000000003  \nr7: 0x00000000bfffd5a0\n    r8: 0x000000000233d428   r9: 0x0000000000000000  r10: 0x00000000056547e0 \nr11: 0x0000000000992bd8\n   r12: 0x00000000070655c0  r13: 0x0000000000990000  r14: 0x0000000000000000 \nr15: 0x0000000001924c40\n   r16: 0x0000000000000000  r17: 0x0000000000000000  r18: 0x00000000bfffd5a0 \nr19: 0x000000000233d428\n   r20: 0x0000000000000000  r21: 0x00000000056547e0  r22: 0x0000000000000048 \nr23: 0x0000000000000000\n   r24: 0x000000000194d760  r25: 0x00000000bfffd520  r26: 0x00000000bfffd740 \nr27: 0x0000000000000000\n   r28: 0x00000000bfffd400  r29: 0x0000000000000000  r30: 0x0000000000000000 \nr31: 0x00000000bfffd440\n\nBinary Images Description:\n    0x1000 -   0x977fff org.mozilla.firefox 1.0.6\n/Applications/Firefox.app/Contents/MacOS/firefox-bin\n  0xdf9000 -   0xdf93c2 Java Applet Plugin Enabler \tPEF binary: Java Applet\nPlugin Enabler\n  0xfbf000 -   0xfc8fff libqfaservices.dylib \n/Applications/Firefox.app/Contents/MacOS/components/libqfaservices.dylib\n 0x1808000 -  0x182ffff talkback.dylib \n/Applications/Firefox.app/Contents/MacOS/components/talkback/talkback.dylib\n 0x18e1000 -  0x18edfff com.apple.JavaAppletPlugin 10.0.0\t/Library/Internet\nPlug-Ins/Java Applet.plugin/Contents/MacOS/Java Applet\n 0x193d990 -  0x193da42 CFMPriv_CoreFoundation \tPEF binary: CFMPriv_CoreFoundation\n 0x193e550 -  0x193e5c7 CFMPriv_System \tPEF binary: CFMPriv_System\n 0x193e840 -  0x193e910 CFMPriv_CarbonSound \tPEF binary: CFMPriv_CarbonSound\n 0x193e980 -  0x193ea53 CFMPriv_CommonPanels \tPEF binary: CFMPriv_CommonPanels\n 0x193eb20 -  0x193ebdb CFMPriv_Help \tPEF binary: CFMPriv_Help\n 0x193ebe0 -  0x193ecaa CFMPriv_HIToolbox \tPEF binary: CFMPriv_HIToolbox\n 0x193ed20 -  0x193edf6 CFMPriv_HTMLRendering \tPEF binary: CFMPriv_HTMLRendering\n 0x193ee60 -  0x193ef33 CFMPriv_ImageCapture \tPEF binary: CFMPriv_ImageCapture\n 0x193efb0 -  0x193f095 CFMPriv_NavigationServices \tPEF binary:\nCFMPriv_NavigationServices\n 0x193f100 -  0x193f1d6 CFMPriv_OpenScripting&#63743;MacBLib \tPEF binary:\nCFMPriv_OpenScripting&#63743;MacBLib\n 0x193f2a0 -  0x193f35e CFMPriv_Print \tPEF binary: CFMPriv_Print\n 0x193f370 -  0x193f43d CFMPriv_SecurityHI \tPEF binary: CFMPriv_SecurityHI\n 0x193f4b0 -  0x193f592 CFMPriv_SpeechRecognition \tPEF binary:\nCFMPriv_SpeechRecognition\n 0x193f600 -  0x193f6d3 CFMPriv_CarbonCore \tPEF binary: CFMPriv_CarbonCore\n 0x193f740 -  0x193f813 CFMPriv_OSServices \tPEF binary: CFMPriv_OSServices\n 0x193f8e0 -  0x193f9a2 CFMPriv_AE \tPEF binary: CFMPriv_AE\n 0x193f9b0 -  0x193fa75 CFMPriv_ATS \tPEF binary: CFMPriv_ATS\n 0x193fae0 -  0x193fbb7 CFMPriv_ColorSync \tPEF binary: CFMPriv_ColorSync\n 0x193fc30 -  0x193fd13 CFMPriv_FindByContent \tPEF binary: CFMPriv_FindByContent\n 0x193fd80 -  0x193fe5a CFMPriv_HIServices \tPEF binary: CFMPriv_HIServices\n 0x193fec0 -  0x193ffa0 CFMPriv_LangAnalysis \tPEF binary: CFMPriv_LangAnalysis\n 0x1940020 -  0x1940106 CFMPriv_LaunchServices \tPEF binary: CFMPriv_LaunchServices\n 0x19401d0 -  0x19402a7 CFMPriv_PrintCore \tPEF binary: CFMPriv_PrintCore\n 0x19402b0 -  0x1940372 CFMPriv_QD \tPEF binary: CFMPriv_QD\n 0x1940460 -  0x1940549 CFMPriv_SpeechSynthesis \tPEF binary: CFMPriv_SpeechSynthesis\n 0x1b81000 -  0x1bd03c7 CarbonLibpwpc \tPEF binary: CarbonLibpwpc\n 0x2ffa000 -  0x2ffcfff com.apple.textencoding.unicode 2.0\n/System/Library/TextEncodings/Unicode Encodings.bundle/Contents/MacOS/Unicode\nEncodings\n 0x3000000 -  0x3032fff libnspr4.dylib \n/Applications/Firefox.app/Contents/MacOS/libnspr4.dylib\n 0x3e3a000 -  0x3e40fff com.apple.DictionaryServiceComponent 1.0.0\n/System/Library/Components/DictionaryService.component/Contents/MacOS/DictionaryService\n 0x4000000 -  0x400dfff libplds4.dylib \n/Applications/Firefox.app/Contents/MacOS/libplds4.dylib\n 0x5000000 -  0x500efff libplc4.dylib \n/Applications/Firefox.app/Contents/MacOS/libplc4.dylib\n 0x6000000 -  0x6068fff libmozjs.dylib \n/Applications/Firefox.app/Contents/MacOS/libmozjs.dylib\n 0x7000000 -  0x7083fff libxpcom.dylib \n/Applications/Firefox.app/Contents/MacOS/libxpcom.dylib\n 0x8000000 -  0x801afff libssl3.dylib \n/Applications/Firefox.app/Contents/MacOS/libssl3.dylib\n 0x9000000 -  0x905dfff libnss3.dylib \n/Applications/Firefox.app/Contents/MacOS/libnss3.dylib\n 0xa000000 -  0xa01dfff libsmime3.dylib \n/Applications/Firefox.app/Contents/MacOS/libsmime3.dylib\n 0xb000000 -  0xb079fff libsoftokn3.dylib \n/Applications/Firefox.app/Contents/MacOS/libsoftokn3.dylib\n 0xc000000 -  0xc019fff libxpcom_compat.dylib \n/Applications/Firefox.app/Contents/MacOS/libxpcom_compat.dylib\n0x8fe00000 - 0x8fe51fff dyld 43.1\t/usr/lib/dyld\n0x90000000 - 0x901a6fff libSystem.B.dylib \t/usr/lib/libSystem.B.dylib\n0x901fe000 - 0x90202fff libmathCommon.A.dylib \t/usr/lib/system/libmathCommon.A.dylib\n0x90204000 - 0x90257fff com.apple.CoreText 1.0.0 (???)\n/System/Library/Frameworks/ApplicationServices.framework/Versions/A/Frameworks/CoreText.framework/Versions/A/CoreText\n0x90284000 - 0x90335fff ATS \n/System/Library/Frameworks/ApplicationServices.framework/Versions/A/Frameworks/ATS.framework/Versions/A/ATS\n0x90364000 - 0x9069dfff com.apple.CoreGraphics 1.256.14 (???)\n/System/Library/Frameworks/ApplicationServices.framework/Versions/A/Frameworks/CoreGraphics.framework/Versions/A/CoreGraphics\n0x90728000 - 0x90801fff com.apple.CoreFoundation 6.4.3 (368.12)\n/System/Library/Frameworks/CoreFoundation.framework/Versions/A/CoreFoundation\n0x9084a000 - 0x9084afff com.apple.CoreServices 10.4 (???)\n/System/Library/Frameworks/CoreServices.framework/Versions/A/CoreServices\n0x9084c000 - 0x9094efff libicucore.A.dylib \t/usr/lib/libicucore.A.dylib\n0x909a8000 - 0x90a2cfff libobjc.A.dylib \t/usr/lib/libobjc.A.dylib\n0x90a56000 - 0x90acafff com.apple.framework.IOKit 1.4 (???)\n/System/Library/Frameworks/IOKit.framework/Versions/A/IOKit\n0x90ae4000 - 0x90af6fff libauto.dylib \t/usr/lib/libauto.dylib\n0x90afd000 - 0x90dc2fff com.apple.CoreServices.CarbonCore 10.4.1 (611.1)\n/System/Library/Frameworks/CoreServices.framework/Versions/A/Frameworks/CarbonCore.framework/Versions/A/CarbonCore\n0x90e25000 - 0x90ea5fff com.apple.CoreServices.OSServices 4.0 (4.0.0)\n/System/Library/Frameworks/CoreServices.framework/Versions/A/Frameworks/OSServices.framework/Versions/A/OSServices\n0x90eef000 - 0x90f2ffff com.apple.CFNetwork 10.4.2 (80)\n/System/Library/Frameworks/CoreServices.framework/Versions/A/Frameworks/CFNetwork.framework/Versions/A/CFNetwork\n0x90f44000 - 0x90f5cfff com.apple.WebServices 1.1.2 (1.1.0)\n/System/Library/Frameworks/CoreServices.framework/Versions/A/Frameworks/WebServicesCore.framework/Versions/A/WebServicesCore\n0x90f6c000 - 0x90feafff com.apple.SearchKit 1.0.3\n/System/Library/Frameworks/CoreServices.framework/Versions/A/Frameworks/SearchKit.framework/Versions/A/SearchKit\n0x9102f000 - 0x91056fff com.apple.Metadata 1.1 (121.6)\n/System/Library/Frameworks/CoreServices.framework/Versions/A/Frameworks/Metadata.framework/Versions/A/Metadata\n0x91077000 - 0x91239fff com.apple.security 4.0.1 (223)\n/System/Library/Frameworks/Security.framework/Versions/A/Security\n0x9133b000 - 0x91344fff com.apple.DiskArbitration 2.1\n/System/Library/Frameworks/DiskArbitration.framework/Versions/A/DiskArbitration\n0x9134b000 - 0x91372fff com.apple.SystemConfiguration 1.8.0\n/System/Library/Frameworks/SystemConfiguration.framework/Versions/A/SystemConfiguration\n0x91385000 - 0x9138dfff libbsm.dylib \t/usr/lib/libbsm.dylib\n0x91391000 - 0x9140ffff com.apple.audio.CoreAudio 3.0.1\n/System/Library/Frameworks/CoreAudio.framework/Versions/A/CoreAudio\n0x9144d000 - 0x9144dfff com.apple.ApplicationServices 10.4 (???)\n/System/Library/Frameworks/ApplicationServices.framework/Versions/A/ApplicationServices\n0x9144f000 - 0x91487fff com.apple.AE 1.5 (297)\n/System/Library/Frameworks/ApplicationServices.framework/Versions/A/Frameworks/AE.framework/Versions/A/AE\n0x914a2000 - 0x9156dfff com.apple.ColorSync 4.4\n/System/Library/Frameworks/ApplicationServices.framework/Versions/A/Frameworks/ColorSync.framework/Versions/A/ColorSync\n0x915c2000 - 0x91655fff com.apple.print.framework.PrintCore 4.0 (172.1)\n/System/Library/Frameworks/ApplicationServices.framework/Versions/A/Frameworks/PrintCore.framework/Versions/A/PrintCore\n0x9169b000 - 0x91758fff com.apple.QD 3.8.6 (???)\n/System/Library/Frameworks/ApplicationServices.framework/Versions/A/Frameworks/QD.framework/Versions/A/QD\n0x91796000 - 0x917f4fff com.apple.HIServices 1.5.0 (???)\n/System/Library/Frameworks/ApplicationServices.framework/Versions/A/Frameworks/HIServices.framework/Versions/A/HIServices\n0x91822000 - 0x91845fff com.apple.LangAnalysis 1.6\n/System/Library/Frameworks/ApplicationServices.framework/Versions/A/Frameworks/LangAnalysis.framework/Versions/A/LangAnalysis\n0x91859000 - 0x9187efff com.apple.FindByContent 1.5\n/System/Library/Frameworks/ApplicationServices.framework/Versions/A/Frameworks/FindByContent.framework/Versions/A/FindByContent\n0x91891000 - 0x918d2fff com.apple.LaunchServices 10.4.3 (157)\n/System/Library/Frameworks/ApplicationServices.framework/Versions/A/Frameworks/LaunchServices.framework/Versions/A/LaunchServices\n0x918ed000 - 0x91901fff com.apple.speech.synthesis.framework 3.3\n/System/Library/Frameworks/ApplicationServices.framework/Versions/A/Frameworks/SpeechSynthesis.framework/Versions/A/SpeechSynthesis\n0x9190f000 - 0x91945fff com.apple.ImageIO.framework 1.0.2\n/System/Library/Frameworks/ApplicationServices.framework/Versions/A/Frameworks/ImageIO.framework/Versions/A/ImageIO\n0x91959000 - 0x91a1ffff libcrypto.0.9.7.dylib \t/usr/lib/libcrypto.0.9.7.dylib\n0x91a6c000 - 0x91a81fff libcups.2.dylib \t/usr/lib/libcups.2.dylib\n0x91a86000 - 0x91aa2fff libJPEG.dylib \n/System/Library/Frameworks/ApplicationServices.framework/Versions/A/Frameworks/ImageIO.framework/Versions/A/Resources/libJPEG.dylib\n0x91aa7000 - 0x91b16fff libJP2.dylib \n/System/Library/Frameworks/ApplicationServices.framework/Versions/A/Frameworks/ImageIO.framework/Versions/A/Resources/libJP2.dylib\n0x91b2d000 - 0x91b31fff libGIF.dylib \n/System/Library/Frameworks/ApplicationServices.framework/Versions/A/Frameworks/ImageIO.framework/Versions/A/Resources/libGIF.dylib\n0x91b33000 - 0x91b4bfff libRaw.dylib \n/System/Library/Frameworks/ApplicationServices.framework/Versions/A/Frameworks/ImageIO.framework/Versions/A/Resources/libRaw.dylib\n0x91b4e000 - 0x91b91fff libTIFF.dylib \n/System/Library/Frameworks/ApplicationServices.framework/Versions/A/Frameworks/ImageIO.framework/Versions/A/Resources/libTIFF.dylib\n0x91b98000 - 0x91bb1fff libPng.dylib \n/System/Library/Frameworks/ApplicationServices.framework/Versions/A/Frameworks/ImageIO.framework/Versions/A/Resources/libPng.dylib\n0x91bb6000 - 0x91bb9fff libRadiance.dylib \n/System/Library/Frameworks/ApplicationServices.framework/Versions/A/Frameworks/ImageIO.framework/Versions/A/Resources/libRadiance.dylib\n0x91bbb000 - 0x91bbbfff com.apple.Accelerate 1.1.1 (Accelerate 1.1.1)\n/System/Library/Frameworks/Accelerate.framework/Versions/A/Accelerate\n0x91bbd000 - 0x91ca7fff com.apple.vImage 2.0\n/System/Library/Frameworks/Accelerate.framework/Versions/A/Frameworks/vImage.framework/Versions/A/vImage\n0x91caf000 - 0x91ccefff com.apple.Accelerate.vecLib 3.1.1 (vecLib 3.1.1)\n/System/Library/Frameworks/Accelerate.framework/Versions/A/Frameworks/vecLib.framework/Versions/A/vecLib\n0x91d3a000 - 0x91d5afff libmx.A.dylib \t/usr/lib/libmx.A.dylib\n0x91d60000 - 0x91dc5fff libvMisc.dylib \n/System/Library/Frameworks/Accelerate.framework/Versions/A/Frameworks/vecLib.framework/Versions/A/libvMisc.dylib\n0x91dcf000 - 0x91e61fff libvDSP.dylib \n/System/Library/Frameworks/Accelerate.framework/Versions/A/Frameworks/vecLib.framework/Versions/A/libvDSP.dylib\n0x91e7b000 - 0x9240bfff libBLAS.dylib \n/System/Library/Frameworks/Accelerate.framework/Versions/A/Frameworks/vecLib.framework/Versions/A/libBLAS.dylib\n0x92453000 - 0x92763fff libLAPACK.dylib \n/System/Library/Frameworks/Accelerate.framework/Versions/A/Frameworks/vecLib.framework/Versions/A/libLAPACK.dylib\n0x92790000 - 0x9281bfff com.apple.DesktopServices 1.3\n/System/Library/PrivateFrameworks/DesktopServicesPriv.framework/Versions/A/DesktopServicesPriv\n0x9285d000 - 0x92a86fff com.apple.Foundation 6.4.1 (567.12)\n/System/Library/Frameworks/Foundation.framework/Versions/C/Foundation\n0x92ba4000 - 0x92c82fff libxml2.2.dylib \t/usr/lib/libxml2.2.dylib\n0x92ca2000 - 0x92d90fff libiconv.2.dylib \t/usr/lib/libiconv.2.dylib\n0x92da2000 - 0x92dc0fff libGL.dylib \n/System/Library/Frameworks/OpenGL.framework/Versions/A/Libraries/libGL.dylib\n0x92dcb000 - 0x92e25fff libGLU.dylib \n/System/Library/Frameworks/OpenGL.framework/Versions/A/Libraries/libGLU.dylib\n0x92e43000 - 0x92e43fff com.apple.Carbon 10.4 (???)\n/System/Library/Frameworks/Carbon.framework/Versions/A/Carbon\n0x92e45000 - 0x92e59fff com.apple.ImageCapture 3.0\n/System/Library/Frameworks/Carbon.framework/Versions/A/Frameworks/ImageCapture.framework/Versions/A/ImageCapture\n0x92e71000 - 0x92e81fff com.apple.speech.recognition.framework 3.4\n/System/Library/Frameworks/Carbon.framework/Versions/A/Frameworks/SpeechRecognition.framework/Versions/A/SpeechRecognition\n0x92e8d000 - 0x92ea2fff com.apple.securityhi 2.0 (203)\n/System/Library/Frameworks/Carbon.framework/Versions/A/Frameworks/SecurityHI.framework/Versions/A/SecurityHI\n0x92eb4000 - 0x92f3bfff com.apple.ink.framework 101.2 (69)\n/System/Library/Frameworks/Carbon.framework/Versions/A/Frameworks/Ink.framework/Versions/A/Ink\n0x92f4f000 - 0x92f5afff com.apple.help 1.0.3 (32)\n/System/Library/Frameworks/Carbon.framework/Versions/A/Frameworks/Help.framework/Versions/A/Help\n0x92f64000 - 0x92f91fff com.apple.openscripting 1.2.2 (???)\n/System/Library/Frameworks/Carbon.framework/Versions/A/Frameworks/OpenScripting.framework/Versions/A/OpenScripting\n0x92fab000 - 0x92fbbfff com.apple.print.framework.Print 4.0 (187)\n/System/Library/Frameworks/Carbon.framework/Versions/A/Frameworks/Print.framework/Versions/A/Print\n0x92fc7000 - 0x9302dfff com.apple.htmlrendering 1.1.2\n/System/Library/Frameworks/Carbon.framework/Versions/A/Frameworks/HTMLRendering.framework/Versions/A/HTMLRendering\n0x9305e000 - 0x930b0fff com.apple.NavigationServices 3.4.1 (3.4)\n/System/Library/Frameworks/Carbon.framework/Versions/A/Frameworks/NavigationServices.framework/Versions/A/NavigationServices\n0x930dc000 - 0x930f9fff com.apple.audio.SoundManager 3.9\n/System/Library/Frameworks/Carbon.framework/Versions/A/Frameworks/CarbonSound.framework/Versions/A/CarbonSound\n0x9310b000 - 0x93118fff com.apple.CommonPanels 1.2.2 (73)\n/System/Library/Frameworks/Carbon.framework/Versions/A/Frameworks/CommonPanels.framework/Versions/A/CommonPanels\n0x93121000 - 0x93431fff com.apple.HIToolbox 1.4.3 (???)\n/System/Library/Frameworks/Carbon.framework/Versions/A/Frameworks/HIToolbox.framework/Versions/A/HIToolbox\n0x9357c000 - 0x93588fff com.apple.opengl 1.4.0\n/System/Library/Frameworks/OpenGL.framework/Versions/A/OpenGL\n0x935bc000 - 0x935c0fff com.apple.JavaVM 10.0.0\n/System/Library/Frameworks/JavaVM.framework/Versions/A/JavaVM\n0x93628000 - 0x93628fff com.apple.Cocoa 6.4 (???)\n/System/Library/Frameworks/Cocoa.framework/Versions/A/Cocoa\n0x9362a000 - 0x93c5bfff com.apple.AppKit 6.4.2 (824.11)\n/System/Library/Frameworks/AppKit.framework/Versions/C/AppKit\n0x93fe7000 - 0x94051fff com.apple.CoreData 1.0 (46)\n/System/Library/Frameworks/CoreData.framework/Versions/A/CoreData\n0x94089000 - 0x94153fff com.apple.audio.toolbox.AudioToolbox 1.4.1\n/System/Library/Frameworks/AudioToolbox.framework/Versions/A/AudioToolbox\n0x941a7000 - 0x941a7fff com.apple.audio.units.AudioUnit 1.4\n/System/Library/Frameworks/AudioUnit.framework/Versions/A/AudioUnit\n0x941a9000 - 0x94308fff com.apple.QuartzCore 1.4.1\n/System/Library/Frameworks/QuartzCore.framework/Versions/A/QuartzCore\n0x94350000 - 0x9438dfff libsqlite3.0.dylib \t/usr/lib/libsqlite3.0.dylib\n0x94395000 - 0x943e0fff libGLImage.dylib \n/System/Library/Frameworks/OpenGL.framework/Versions/A/Libraries/libGLImage.dylib\n0x94581000 - 0x94590fff libCGATS.A.dylib \n/System/Library/Frameworks/ApplicationServices.framework/Versions/A/Frameworks/CoreGraphics.framework/Versions/A/Resources/libCGATS.A.dylib\n0x94598000 - 0x945a4fff libCSync.A.dylib \n/System/Library/Frameworks/ApplicationServices.framework/Versions/A/Frameworks/CoreGraphics.framework/Versions/A/Resources/libCSync.A.dylib\n0x945e9000 - 0x945fdfff libRIP.A.dylib \n/System/Library/Frameworks/ApplicationServices.framework/Versions/A/Frameworks/CoreGraphics.framework/Versions/A/Resources/libRIP.A.dylib\n0x94603000 - 0x94865fff com.apple.QuickTime 7.0.1\n/System/Library/Frameworks/QuickTime.framework/Versions/A/QuickTime\n0x94938000 - 0x94957fff com.apple.vecLib 3.1.1 (vecLib 3.1.1)\n/System/Library/Frameworks/vecLib.framework/Versions/A/vecLib\n0x94d3e000 - 0x94ed4fff libjvm.dylib \n/System/Library/Frameworks/JavaVM.framework/Versions/1.3/Libraries/libjvm.dylib\n0x94f15000 - 0x94f16fff com.apple.JavaCarbonSupport 10.0.0\n/System/Library/PrivateFrameworks/JavaCarbonSupport.framework/Versions/A/JavaCarbonSupport\n0x94f18000 - 0x94f22fff libverify.dylib \n/System/Library/Frameworks/JavaVM.framework/Versions/1.3.1/Libraries/libverify.dylib\n0x94f57000 - 0x94f70fff libjava.jnilib \n/System/Library/Frameworks/JavaVM.framework/Versions/1.3.1/Libraries/libjava.jnilib\n0x95069000 - 0x95074fff libzip.jnilib \n/System/Library/Frameworks/JavaVM.framework/Versions/1.3.1/Libraries/libzip.jnilib\n0x9878d000 - 0x9879bfff com.apple.JavaEmbedding 10.0.0\n/System/Library/Frameworks/JavaEmbedding.framework/Versions/A/JavaEmbedding\n0x9cbba000 - 0x9cbc8fff libz.1.dylib \t/usr/lib/libz.1.dylib\n\nModel: PowerMac10,1, BootROM 4.8.9f1, 1 processors, PowerPC G4  (1.2), 1.42 GHz,\n512 MB\nGraphics: ATI Radeon 9200, ATY,RV280, AGP, 32 MB\nMemory Module: DIMM0/J11, 512 MB, DDR SDRAM, PC3200U-30330\nAirPort: AirPort Extreme, 400.17 (3.90.34.0.p11)\nModem: Jump, , V.92, Version 1.0, \nBluetooth: Version 1.6.0f2, 2 service, 1 devices, 0 incoming serial ports\nNetwork Service: Ethernet int\u00e9gr\u00e9, Ethernet, en0\nParallel ATA Device: ST9808210A, 74.53 GB\nParallel ATA Device: MATSHITACD-RW  CW-8124, \nUSB Device: Bluetooth HCI, , Up to 12 Mb/sec, 500 mA\nUSB Device: Hub, , Up to 12 Mb/sec, 500 mA\nUSB Device: RadioSHARK, Griffin Technology, Inc., Up to 12 Mb/sec, 500 mA\nUSB Device: USB Keyboard, HEWLETT PACKARD, Up to 1.5 Mb/sec, 500 mA\nUSB Device: USB Audio, , Up to 12 Mb/sec, 500 mA\nUSB Device: USB Device, , Up to 1.5 Mb/sec, 500 mA\n",
      "matched_patterns": [
        "^\\s*\\d+\\s+\\S+\\s+0x[0-9a-fA-F]+",
        "ns[A-Z]\\w+::\\w+",
        "(?i)(crash|stack)\\s*(trace|dump|report)",
        "(?i)thread\\s+\\d+\\s*:"
      ],
      "parsed_frames": [
        {
          "frame_index": 1,
          "module": "libxpcom.dylib",
          "function": "0x0705997c _XPTC_InvokeByIndex + 216",
          "file": "",
          "line": null,
          "raw": "1   libxpcom.dylib      \t0x0705997c _XPTC_InvokeByIndex + 216"
        },
        {
          "frame_index": 4,
          "module": "libmozjs.dylib",
          "function": "0x060291a8 js_Invoke + 1716",
          "file": "",
          "line": null,
          "raw": "4   libmozjs.dylib      \t0x060291a8 js_Invoke + 1716"
        },
        {
          "frame_index": 5,
          "module": "libmozjs.dylib",
          "function": "0x060305c4 js_Interpret + 26324",
          "file": "",
          "line": null,
          "raw": "5   libmozjs.dylib      \t0x060305c4 js_Interpret + 26324"
        },
        {
          "frame_index": 6,
          "module": "libmozjs.dylib",
          "function": "0x06029784 js_Execute + 496",
          "file": "",
          "line": null,
          "raw": "6   libmozjs.dylib      \t0x06029784 js_Execute + 496"
        },
        {
          "frame_index": 7,
          "module": "libmozjs.dylib",
          "function": "0x06007228 JS_EvaluateUCScriptForPrincipals + 88",
          "file": "",
          "line": null,
          "raw": "7   libmozjs.dylib      \t0x06007228 JS_EvaluateUCScriptForPrincipals + 88"
        },
        {
          "frame_index": 29,
          "module": "libxpcom.dylib",
          "function": "0x0708010c",
          "file": "",
          "line": null,
          "raw": "29  libxpcom.dylib      \t0x0708010c"
        },
        {
          "frame_index": 30,
          "module": "libxpcom.dylib",
          "function": "0x07041cf8 PL_HandleEvent + 36",
          "file": "",
          "line": null,
          "raw": "30  libxpcom.dylib      \t0x07041cf8 PL_HandleEvent + 36"
        },
        {
          "frame_index": 31,
          "module": "libxpcom.dylib",
          "function": "0x07041c1c PL_ProcessPendingEvents + 128",
          "file": "",
          "line": null,
          "raw": "31  libxpcom.dylib      \t0x07041c1c PL_ProcessPendingEvents + 128"
        },
        {
          "frame_index": 32,
          "module": "libxpcom.dylib",
          "function": "0x07042100 PL_IsQueueNative + 136",
          "file": "",
          "line": null,
          "raw": "32  libxpcom.dylib      \t0x07042100 PL_IsQueueNative + 136"
        },
        {
          "frame_index": 1,
          "module": "libnspr4.dylib",
          "function": "0x0301f7dc poll + 392",
          "file": "",
          "line": null,
          "raw": "1   libnspr4.dylib      \t0x0301f7dc poll + 392"
        },
        {
          "frame_index": 2,
          "module": "libnspr4.dylib",
          "function": "0x0301c028 PR_OpenDir + 944",
          "file": "",
          "line": null,
          "raw": "2   libnspr4.dylib      \t0x0301c028 PR_OpenDir + 944"
        },
        {
          "frame_index": 4,
          "module": "libxpcom.dylib",
          "function": "0x070449c4 nsThread::Main(void*) + 56",
          "file": "",
          "line": null,
          "raw": "4   libxpcom.dylib      \t0x070449c4 nsThread::Main(void*) + 56"
        },
        {
          "frame_index": 5,
          "module": "libnspr4.dylib",
          "function": "0x0301d470 PR_Select + 828",
          "file": "",
          "line": null,
          "raw": "5   libnspr4.dylib      \t0x0301d470 PR_Select + 828"
        },
        {
          "frame_index": 2,
          "module": "libjvm.dylib",
          "function": "0x94deae48 JNI_CreateJavaVM_Impl + 5936",
          "file": "",
          "line": null,
          "raw": "2   libjvm.dylib        \t0x94deae48 JNI_CreateJavaVM_Impl + 5936"
        },
        {
          "frame_index": 3,
          "module": "libjvm.dylib",
          "function": "0x94deaddc JNI_CreateJavaVM_Impl + 5828",
          "file": "",
          "line": null,
          "raw": "3   libjvm.dylib        \t0x94deaddc JNI_CreateJavaVM_Impl + 5828"
        },
        {
          "frame_index": 4,
          "module": "libjvm.dylib",
          "function": "0x94dabfe0 JVM_GetClassMethodsCount + 520",
          "file": "",
          "line": null,
          "raw": "4   libjvm.dylib        \t0x94dabfe0 JVM_GetClassMethodsCount + 520"
        },
        {
          "frame_index": 2,
          "module": "libjvm.dylib",
          "function": "0x94d48cb4 JVM_NewInstance + 8136",
          "file": "",
          "line": null,
          "raw": "2   libjvm.dylib        \t0x94d48cb4 JVM_NewInstance + 8136"
        },
        {
          "frame_index": 3,
          "module": "libjvm.dylib",
          "function": "0x94d68304 JVM_FillInStackTrace + 692",
          "file": "",
          "line": null,
          "raw": "3   libjvm.dylib        \t0x94d68304 JVM_FillInStackTrace + 692"
        },
        {
          "frame_index": 4,
          "module": "libjvm.dylib",
          "function": "0x94d6dd10 JVM_Send + 17088",
          "file": "",
          "line": null,
          "raw": "4   libjvm.dylib        \t0x94d6dd10 JVM_Send + 17088"
        },
        {
          "frame_index": 5,
          "module": "libjvm.dylib",
          "function": "0x94dffd38 JNI_CreateJavaVM_Impl + 91680",
          "file": "",
          "line": null,
          "raw": "5   libjvm.dylib        \t0x94dffd38 JNI_CreateJavaVM_Impl + 91680"
        },
        {
          "frame_index": 6,
          "module": "libjvm.dylib",
          "function": "0x94dabfe0 JVM_GetClassMethodsCount + 520",
          "file": "",
          "line": null,
          "raw": "6   libjvm.dylib        \t0x94dabfe0 JVM_GetClassMethodsCount + 520"
        },
        {
          "frame_index": 2,
          "module": "libjvm.dylib",
          "function": "0x94d48c20 JVM_NewInstance + 7988",
          "file": "",
          "line": null,
          "raw": "2   libjvm.dylib        \t0x94d48c20 JVM_NewInstance + 7988"
        },
        {
          "frame_index": 3,
          "module": "libjvm.dylib",
          "function": "0x94d50df0 JVM_ArrayCopy + 1240",
          "file": "",
          "line": null,
          "raw": "3   libjvm.dylib        \t0x94d50df0 JVM_ArrayCopy + 1240"
        },
        {
          "frame_index": 4,
          "module": "libjvm.dylib",
          "function": "0x94d66f28 JVM_MonitorNotify + 1908",
          "file": "",
          "line": null,
          "raw": "4   libjvm.dylib        \t0x94d66f28 JVM_MonitorNotify + 1908"
        },
        {
          "frame_index": 5,
          "module": "libjvm.dylib",
          "function": "0x94d67b9c JVM_MonitorWait + 216",
          "file": "",
          "line": null,
          "raw": "5   libjvm.dylib        \t0x94d67b9c JVM_MonitorWait + 216"
        },
        {
          "frame_index": 10,
          "module": "libjvm.dylib",
          "function": "0x94d464ac JVM_CurrentTimeMillis + 4968",
          "file": "",
          "line": null,
          "raw": "10  libjvm.dylib        \t0x94d464ac JVM_CurrentTimeMillis + 4968"
        },
        {
          "frame_index": 11,
          "module": "libjvm.dylib",
          "function": "0x94d7b970 JVM_GetCPClassNameUTF + 6044",
          "file": "",
          "line": null,
          "raw": "11  libjvm.dylib        \t0x94d7b970 JVM_GetCPClassNameUTF + 6044"
        },
        {
          "frame_index": 12,
          "module": "libjvm.dylib",
          "function": "0x94d811e4 JVM_FindClassFromClass + 2668",
          "file": "",
          "line": null,
          "raw": "12  libjvm.dylib        \t0x94d811e4 JVM_FindClassFromClass + 2668"
        },
        {
          "frame_index": 13,
          "module": "libjvm.dylib",
          "function": "0x94d9a508 JVM_IsSameClassPackage + 4016",
          "file": "",
          "line": null,
          "raw": "13  libjvm.dylib        \t0x94d9a508 JVM_IsSameClassPackage + 4016"
        },
        {
          "frame_index": 14,
          "module": "libjvm.dylib",
          "function": "0x94d94adc JVM_GetMethodIxExceptionTableEntry + 8240",
          "file": "",
          "line": null,
          "raw": "14  libjvm.dylib        \t0x94d94adc JVM_GetMethodIxExceptionTableEntry + 8240"
        },
        {
          "frame_index": 15,
          "module": "libjvm.dylib",
          "function": "0x94e82f08 JVM_FindSignal + 208316",
          "file": "",
          "line": null,
          "raw": "15  libjvm.dylib        \t0x94e82f08 JVM_FindSignal + 208316"
        },
        {
          "frame_index": 16,
          "module": "libjvm.dylib",
          "function": "0x94dabfe0 JVM_GetClassMethodsCount + 520",
          "file": "",
          "line": null,
          "raw": "16  libjvm.dylib        \t0x94dabfe0 JVM_GetClassMethodsCount + 520"
        },
        {
          "frame_index": 2,
          "module": "libjvm.dylib",
          "function": "0x94d48c20 JVM_NewInstance + 7988",
          "file": "",
          "line": null,
          "raw": "2   libjvm.dylib        \t0x94d48c20 JVM_NewInstance + 7988"
        },
        {
          "frame_index": 3,
          "module": "libjvm.dylib",
          "function": "0x94d50df0 JVM_ArrayCopy + 1240",
          "file": "",
          "line": null,
          "raw": "3   libjvm.dylib        \t0x94d50df0 JVM_ArrayCopy + 1240"
        },
        {
          "frame_index": 4,
          "module": "libjvm.dylib",
          "function": "0x94d66f28 JVM_MonitorNotify + 1908",
          "file": "",
          "line": null,
          "raw": "4   libjvm.dylib        \t0x94d66f28 JVM_MonitorNotify + 1908"
        },
        {
          "frame_index": 5,
          "module": "libjvm.dylib",
          "function": "0x94d67b9c JVM_MonitorWait + 216",
          "file": "",
          "line": null,
          "raw": "5   libjvm.dylib        \t0x94d67b9c JVM_MonitorWait + 216"
        },
        {
          "frame_index": 11,
          "module": "libjvm.dylib",
          "function": "0x94d464ac JVM_CurrentTimeMillis + 4968",
          "file": "",
          "line": null,
          "raw": "11  libjvm.dylib        \t0x94d464ac JVM_CurrentTimeMillis + 4968"
        },
        {
          "frame_index": 12,
          "module": "libjvm.dylib",
          "function": "0x94d7b970 JVM_GetCPClassNameUTF + 6044",
          "file": "",
          "line": null,
          "raw": "12  libjvm.dylib        \t0x94d7b970 JVM_GetCPClassNameUTF + 6044"
        },
        {
          "frame_index": 13,
          "module": "libjvm.dylib",
          "function": "0x94d811e4 JVM_FindClassFromClass + 2668",
          "file": "",
          "line": null,
          "raw": "13  libjvm.dylib        \t0x94d811e4 JVM_FindClassFromClass + 2668"
        },
        {
          "frame_index": 14,
          "module": "libjvm.dylib",
          "function": "0x94d9a508 JVM_IsSameClassPackage + 4016",
          "file": "",
          "line": null,
          "raw": "14  libjvm.dylib        \t0x94d9a508 JVM_IsSameClassPackage + 4016"
        },
        {
          "frame_index": 15,
          "module": "libjvm.dylib",
          "function": "0x94d94adc JVM_GetMethodIxExceptionTableEntry + 8240",
          "file": "",
          "line": null,
          "raw": "15  libjvm.dylib        \t0x94d94adc JVM_GetMethodIxExceptionTableEntry + 8240"
        },
        {
          "frame_index": 16,
          "module": "libjvm.dylib",
          "function": "0x94e82f08 JVM_FindSignal + 208316",
          "file": "",
          "line": null,
          "raw": "16  libjvm.dylib        \t0x94e82f08 JVM_FindSignal + 208316"
        },
        {
          "frame_index": 17,
          "module": "libjvm.dylib",
          "function": "0x94dabfe0 JVM_GetClassMethodsCount + 520",
          "file": "",
          "line": null,
          "raw": "17  libjvm.dylib        \t0x94dabfe0 JVM_GetClassMethodsCount + 520"
        },
        {
          "frame_index": 2,
          "module": "libjvm.dylib",
          "function": "0x94d48cb4 JVM_NewInstance + 8136",
          "file": "",
          "line": null,
          "raw": "2   libjvm.dylib        \t0x94d48cb4 JVM_NewInstance + 8136"
        },
        {
          "frame_index": 3,
          "module": "libjvm.dylib",
          "function": "0x94d4fdcc JVM_GetClassLoader + 6148",
          "file": "",
          "line": null,
          "raw": "3   libjvm.dylib        \t0x94d4fdcc JVM_GetClassLoader + 6148"
        },
        {
          "frame_index": 4,
          "module": "libjvm.dylib",
          "function": "0x94d4fb74 JVM_GetClassLoader + 5548",
          "file": "",
          "line": null,
          "raw": "4   libjvm.dylib        \t0x94d4fb74 JVM_GetClassLoader + 5548"
        },
        {
          "frame_index": 5,
          "module": "libjvm.dylib",
          "function": "0x94dabfe0 JVM_GetClassMethodsCount + 520",
          "file": "",
          "line": null,
          "raw": "5   libjvm.dylib        \t0x94dabfe0 JVM_GetClassMethodsCount + 520"
        },
        {
          "frame_index": 2,
          "module": "libjvm.dylib",
          "function": "0x94d48c20 JVM_NewInstance + 7988",
          "file": "",
          "line": null,
          "raw": "2   libjvm.dylib        \t0x94d48c20 JVM_NewInstance + 7988"
        },
        {
          "frame_index": 3,
          "module": "libjvm.dylib",
          "function": "0x94d6835c JVM_FillInStackTrace + 780",
          "file": "",
          "line": null,
          "raw": "3   libjvm.dylib        \t0x94d6835c JVM_FillInStackTrace + 780"
        },
        {
          "frame_index": 4,
          "module": "libjvm.dylib",
          "function": "0x94e020a4 JVM_InitProperties + 6836",
          "file": "",
          "line": null,
          "raw": "4   libjvm.dylib        \t0x94e020a4 JVM_InitProperties + 6836"
        },
        {
          "frame_index": 5,
          "module": "libjvm.dylib",
          "function": "0x94e01ea0 JVM_InitProperties + 6320",
          "file": "",
          "line": null,
          "raw": "5   libjvm.dylib        \t0x94e01ea0 JVM_InitProperties + 6320"
        },
        {
          "frame_index": 6,
          "module": "libjvm.dylib",
          "function": "0x94e82f08 JVM_FindSignal + 208316",
          "file": "",
          "line": null,
          "raw": "6   libjvm.dylib        \t0x94e82f08 JVM_FindSignal + 208316"
        },
        {
          "frame_index": 7,
          "module": "libjvm.dylib",
          "function": "0x94dabfe0 JVM_GetClassMethodsCount + 520",
          "file": "",
          "line": null,
          "raw": "7   libjvm.dylib        \t0x94dabfe0 JVM_GetClassMethodsCount + 520"
        },
        {
          "frame_index": 2,
          "module": "libjvm.dylib",
          "function": "0x94d48c20 JVM_NewInstance + 7988",
          "file": "",
          "line": null,
          "raw": "2   libjvm.dylib        \t0x94d48c20 JVM_NewInstance + 7988"
        },
        {
          "frame_index": 3,
          "module": "libjvm.dylib",
          "function": "0x94d6835c JVM_FillInStackTrace + 780",
          "file": "",
          "line": null,
          "raw": "3   libjvm.dylib        \t0x94d6835c JVM_FillInStackTrace + 780"
        },
        {
          "frame_index": 4,
          "module": "libjvm.dylib",
          "function": "0x94d90710 JVM_StartThread + 1388",
          "file": "",
          "line": null,
          "raw": "4   libjvm.dylib        \t0x94d90710 JVM_StartThread + 1388"
        },
        {
          "frame_index": 5,
          "module": "libjvm.dylib",
          "function": "0x94d7f280 JVM_FindLoadedClass + 2632",
          "file": "",
          "line": null,
          "raw": "5   libjvm.dylib        \t0x94d7f280 JVM_FindLoadedClass + 2632"
        },
        {
          "frame_index": 6,
          "module": "libjvm.dylib",
          "function": "0x94e82f08 JVM_FindSignal + 208316",
          "file": "",
          "line": null,
          "raw": "6   libjvm.dylib        \t0x94e82f08 JVM_FindSignal + 208316"
        },
        {
          "frame_index": 7,
          "module": "libjvm.dylib",
          "function": "0x94dabfe0 JVM_GetClassMethodsCount + 520",
          "file": "",
          "line": null,
          "raw": "7   libjvm.dylib        \t0x94dabfe0 JVM_GetClassMethodsCount + 520"
        },
        {
          "frame_index": 2,
          "module": "libnspr4.dylib",
          "function": "0x03018390 PR_Unlock + 300",
          "file": "",
          "line": null,
          "raw": "2   libnspr4.dylib      \t0x03018390 PR_Unlock + 300"
        },
        {
          "frame_index": 3,
          "module": "libnspr4.dylib",
          "function": "0x030185f4 PR_WaitCondVar + 136",
          "file": "",
          "line": null,
          "raw": "3   libnspr4.dylib      \t0x030185f4 PR_WaitCondVar + 136"
        },
        {
          "frame_index": 4,
          "module": "libxpcom.dylib",
          "function": "0x070474d8 TimerThread::Run() + 428",
          "file": "",
          "line": null,
          "raw": "4   libxpcom.dylib      \t0x070474d8 TimerThread::Run() + 428"
        },
        {
          "frame_index": 5,
          "module": "libxpcom.dylib",
          "function": "0x070449c4 nsThread::Main(void*) + 56",
          "file": "",
          "line": null,
          "raw": "5   libxpcom.dylib      \t0x070449c4 nsThread::Main(void*) + 56"
        },
        {
          "frame_index": 6,
          "module": "libnspr4.dylib",
          "function": "0x0301d470 PR_Select + 828",
          "file": "",
          "line": null,
          "raw": "6   libnspr4.dylib      \t0x0301d470 PR_Select + 828"
        },
        {
          "frame_index": 2,
          "module": "libnspr4.dylib",
          "function": "0x03018390 PR_Unlock + 300",
          "file": "",
          "line": null,
          "raw": "2   libnspr4.dylib      \t0x03018390 PR_Unlock + 300"
        },
        {
          "frame_index": 3,
          "module": "libnspr4.dylib",
          "function": "0x030185f4 PR_WaitCondVar + 136",
          "file": "",
          "line": null,
          "raw": "3   libnspr4.dylib      \t0x030185f4 PR_WaitCondVar + 136"
        },
        {
          "frame_index": 5,
          "module": "libnspr4.dylib",
          "function": "0x0301d470 PR_Select + 828",
          "file": "",
          "line": null,
          "raw": "5   libnspr4.dylib      \t0x0301d470 PR_Select + 828"
        },
        {
          "frame_index": 2,
          "module": "libnspr4.dylib",
          "function": "0x03018390 PR_Unlock + 300",
          "file": "",
          "line": null,
          "raw": "2   libnspr4.dylib      \t0x03018390 PR_Unlock + 300"
        },
        {
          "frame_index": 3,
          "module": "libnspr4.dylib",
          "function": "0x030185f4 PR_WaitCondVar + 136",
          "file": "",
          "line": null,
          "raw": "3   libnspr4.dylib      \t0x030185f4 PR_WaitCondVar + 136"
        },
        {
          "frame_index": 6,
          "module": "libnspr4.dylib",
          "function": "0x0301d470 PR_Select + 828",
          "file": "",
          "line": null,
          "raw": "6   libnspr4.dylib      \t0x0301d470 PR_Select + 828"
        },
        {
          "frame_index": 2,
          "module": "libnspr4.dylib",
          "function": "0x03018390 PR_Unlock + 300",
          "file": "",
          "line": null,
          "raw": "2   libnspr4.dylib      \t0x03018390 PR_Unlock + 300"
        },
        {
          "frame_index": 3,
          "module": "libnspr4.dylib",
          "function": "0x030185f4 PR_WaitCondVar + 136",
          "file": "",
          "line": null,
          "raw": "3   libnspr4.dylib      \t0x030185f4 PR_WaitCondVar + 136"
        },
        {
          "frame_index": 5,
          "module": "libnspr4.dylib",
          "function": "0x0301d470 PR_Select + 828",
          "file": "",
          "line": null,
          "raw": "5   libnspr4.dylib      \t0x0301d470 PR_Select + 828"
        }
      ],
      "frame_count": 73
    }
  ],
  "has_stack_traces": true,
  "stack_trace_count": 1,
  "total_parsed_frames": 73
}